url|available|name|reg_price|current_price|pretax_price|cats|ref|color|level|type|user_type|co2_eco|product_type|quality|size|brand|weight|weight_type|price_valid_date|page_has_issues|desc|rating|nb_rating|rate_1|rate_2|rate_3|rate_4|rate_5|img
https://freeglisse.com/fr/ski-occasion-femme-all-mountain/15051-298780-ski-occasion-rossignol-temptation-style-fixations.html#/3-etat_du_materiel-qualite_a/912-taille_skis-170_cm|True|Ski occasion Rossignol Temptation Style + fixations|208.0|139.0|115.833333|['Ski occasion', 'Ski occasion femme', 'Occasion', 'Ski occasion femme all mountain']|15051_m18|Rose|Loisir|All mountain|Femme|3.6|Ski occasion femme all mountain|['Qualité A']|['146 cm', '170 cm']|Rossignol|6.0|kg|2025-01-31|False|"[""Le ski femme all-mountain Rossignol TEMPTATION 84 Style est la promesse d'une sortie ski réussie dans toutes les conditions. Un ski ludique destiné à des skieuses au niveau avancé à expert, qui laisse la possibilité de jouer avec le terrain quel qu'il soit. Sa morphologie lui confère une très bonne tenue sur piste pour tailler des courbes à l'envi et la possibilité d'attaquer les virages sans hésitation, alors que sa légèreté, son rocker et sa largeur sous le pied en font un atout pour les bords de pistes et la poudreuse."", 'Année : 2016', 'Lignes de côtes : 133 84 120', 'Rayon de 11 m pour un ski de 154 cm', 'Fiche technique', 'Type', 'All mountain', 'Utilisateur', 'Femme', 'Niveau', 'Loisir', 'Coloris', 'Rose', 'Economie de CO2 pour la planète (en kg)', '3.6', 'Type de produit', 'Ski occasion femme all mountain', ""►\xa0État d'usure de nos skis et snowboards"", ""■ Qualité A : Matériel d'occasion en bon état"", ""Qualité A propose du matériel d'occasion ayant un bon état général, bien entretenu et pouvant être utilisé pendant de nombreuses saisons :"", 'Les qualités techniques et la durabilité du matériel sont excellentes', 'La sérigraphie peut également comporter quelques rayures et quelques accrocs', ""Fixations d'occasion en bon état (vérifiées par nos skimans) mais pouvant comporter cependant quelques rayures d'usage & quelque peu décolorées"", 'La semelle est parfaitement rebouchée, structurée et fartée. Les carres sont affûtées.', ""■ Qualité B : Matériel d'occasion en état correct"", ""La catégorie Qualité B possède du matériel d'occasion en état correct, mais présentant des marques d'usures plus prononcées (présence de rayures et d'accrocs) :"", 'La technicité et la durabilité du matériel restent bonnes malgré un esthétique plus ancien', ""Présence de rayures et d'accrocs plus prononcés sur plusieurs endroits de la sérigraphie, notamment au niveau de la spatule et du talon"", 'La fixation peut être rayée ou décolorée (toujours révisée par nos skimans)', 'La semelle est parfaitement rebouchée, structurée ainsi que fartée et les carres sont affûtées, comme pour le matériel de Qualité A', 'Prix attractif', '■ Qualité C : Matériel dont la sérigraphie est dégradée mais toujours performant', 'La catégorie Qualité C propose du matériel abîmé, dont la sérigraphie est dégradée mais qui reste skiable et performant :', ""Le matériel ayant déjà servi pendant plusieurs saisons, la sérigraphie est abimée et présente des traces plus importantes d'usures comme des rayures et des accrocs, mais qui n'a aucune influence sur la performance de celui-ci"", ""La fixation (toujours révisée par nos skimans) présente des traces d'usures plus importantes : décoloration, rayures, accrocs… Elle ne présente aucun danger pour l'utilisateur."", ""La semelle est parfaitement rebouchée, structurée et fartée. Les carres sont également affûtées, exactement comme les choix précédents. Attention : le matériel ayant déjà été bien utilisé, il ne reste plus beaucoup d'épaisseur de semelle ou de carre qui permettront de nouveaux entretiens."", 'Plus de détails sur la page\xa0état du matériel.', ""Voir l'attestation de confiance"", 'Avis soumis à un contrôle', ' ', ' ', "" Pour plus d'informations sur les caractéristiques du contrôle des avis et la possibilité de contacter l'auteur de l'avis, merci de consulter nos Charte de transparence."", "" Aucune contrepartie n'a été fournie en échange des avis"", ' Les avis sont publiés et conservés pendant une durée de cinq ans', "" Les avis ne sont pas modifiables : si un client souhaite modifier son avis, il doit contacter Avis Verifiés afin de supprimer l'avis existant, et en publier un nouveau"", ' Les motifs de suppression des avis sont disponibles ici.', '                  ', '               4 /5', ' ', ' ', '                Calculé à partir de   2  avis client(s)', '            ', '1', ' ', ' 0 ', '2', ' ', ' 0 ', '3', ' ', ' 1 ', '4', ' ', ' 0 ', '5', ' ', ' 1 ', ""Trier l'affichage des avis :"", '---', 'Les plus récents', 'Les plus anciens', 'Note la plus élevée', 'Note la plus faible', 'Les plus utiles ', '                                  Bjoern S.', '               ', '               publié le 15/09/2024', 'suite à une commande du 07/09/2024', ' ', ' ', '                  5/5', '               ', '               Perfekt\r', ' Alles wie beschrieben', '            ', '                        Cet avis vous a-t-il été utile ?                        Oui 0', 'Non 0', '                                  Client anonyme', '               ', '               publié le 19/12/2022', 'suite à une commande du 04/12/2022', ' ', ' ', '                  3/5', '               ', ""               Label qualité A inadéquat en regard de l'état d'usure de la paire de skis reçus, surtout au niveau des fixations ! En revanche, semelle et carres très bien refaits. Mais globalement déçu, du coup, c'est dommage. Livraison nickel."", '            ', '                        Cet avis vous a-t-il été utile ?                        Oui 0', 'Non 0', '×']"|4.0|2.0|0.0|0.0|1.0|0.0|1.0|https://freeglisse.com/47906-thickbox_default/ski-occasion-rossignol-temptation-style-fixations.jpg
https://freeglisse.com/fr/ski-occasion-adulte-all-mountain/18284-405601-ski-occasion-dynastar-speed-zone-4x4-78-fixations.html#/9-etat_du_materiel-qualite_b/913-taille_skis-171_cm|True|Ski occasion Dynastar Speed Zone 4x4 78 + fixations|278.0|179.0|149.166667|['Ski occasion', 'Occasion', 'Ski occasion adulte', 'Ski occasion adulte all mountain']|18284_g25|Gris|Loisir sport|All mountain|Mixte|3.6|Ski occasion adulte all mountain|['Qualité B']|['171 cm', '179 cm']|Dynastar|6.0|kg|2025-01-31|False|"[""Le ski de piste ultra polyvalent par excellence, agile confortable et performant grâce à la HYBRIDCORE technologie. Le plaisir et le FUN à l'état pur."", 'Ligne de côtes : 122 78 106', 'Rayon de 15 m pour un ski de 171 cm', 'Année : 2020', 'Prix neuf : 449 €', 'Fiche technique', 'Type', 'All mountain', 'Utilisateur', 'Mixte', 'Niveau', 'Loisir sport', 'Coloris', 'Gris', 'Economie de CO2 pour la planète (en kg)', '3.6', 'Type de produit', 'Ski occasion adulte all mountain', ""►\xa0État d'usure de nos skis et snowboards"", ""■ Qualité A : Matériel d'occasion en bon état"", ""Qualité A propose du matériel d'occasion ayant un bon état général, bien entretenu et pouvant être utilisé pendant de nombreuses saisons :"", 'Les qualités techniques et la durabilité du matériel sont excellentes', 'La sérigraphie peut également comporter quelques rayures et quelques accrocs', ""Fixations d'occasion en bon état (vérifiées par nos skimans) mais pouvant comporter cependant quelques rayures d'usage & quelque peu décolorées"", 'La semelle est parfaitement rebouchée, structurée et fartée. Les carres sont affûtées.', ""■ Qualité B : Matériel d'occasion en état correct"", ""La catégorie Qualité B possède du matériel d'occasion en état correct, mais présentant des marques d'usures plus prononcées (présence de rayures et d'accrocs) :"", 'La technicité et la durabilité du matériel restent bonnes malgré un esthétique plus ancien', ""Présence de rayures et d'accrocs plus prononcés sur plusieurs endroits de la sérigraphie, notamment au niveau de la spatule et du talon"", 'La fixation peut être rayée ou décolorée (toujours révisée par nos skimans)', 'La semelle est parfaitement rebouchée, structurée ainsi que fartée et les carres sont affûtées, comme pour le matériel de Qualité A', 'Prix attractif', '■ Qualité C : Matériel dont la sérigraphie est dégradée mais toujours performant', 'La catégorie Qualité C propose du matériel abîmé, dont la sérigraphie est dégradée mais qui reste skiable et performant :', ""Le matériel ayant déjà servi pendant plusieurs saisons, la sérigraphie est abimée et présente des traces plus importantes d'usures comme des rayures et des accrocs, mais qui n'a aucune influence sur la performance de celui-ci"", ""La fixation (toujours révisée par nos skimans) présente des traces d'usures plus importantes : décoloration, rayures, accrocs… Elle ne présente aucun danger pour l'utilisateur."", ""La semelle est parfaitement rebouchée, structurée et fartée. Les carres sont également affûtées, exactement comme les choix précédents. Attention : le matériel ayant déjà été bien utilisé, il ne reste plus beaucoup d'épaisseur de semelle ou de carre qui permettront de nouveaux entretiens."", 'Plus de détails sur la page\xa0état du matériel.', ""Voir l'attestation de confiance"", 'Avis soumis à un contrôle', ' ', ' ', "" Pour plus d'informations sur les caractéristiques du contrôle des avis et la possibilité de contacter l'auteur de l'avis, merci de consulter nos Charte de transparence."", "" Aucune contrepartie n'a été fournie en échange des avis"", ' Les avis sont publiés et conservés pendant une durée de cinq ans', "" Les avis ne sont pas modifiables : si un client souhaite modifier son avis, il doit contacter Avis Verifiés afin de supprimer l'avis existant, et en publier un nouveau"", ' Les motifs de suppression des avis sont disponibles ici.', '                  ', '               3 /5', ' ', ' ', '                Calculé à partir de   1  avis client(s)', '            ', '1', ' ', ' 0 ', '2', ' ', ' 0 ', '3', ' ', ' 1 ', '4', ' ', ' 0 ', '5', ' ', ' 0 ', ""Trier l'affichage des avis :"", '---', 'Les plus récents', 'Les plus anciens', 'Note la plus élevée', 'Note la plus faible', 'Les plus utiles ', '                                  Christophe B.', '               ', '               publié le 10/08/2024', 'suite à une commande du 03/08/2024', ' ', ' ', '                  3/5', '               ', ""               Déçu de l'état des skis qui étaient en qualité A, ils ne valent qu'une B."", '            ', '                        Cet avis vous a-t-il été utile ?                        Oui 0', 'Non 0', '×']"|3.0|1.0|0.0|0.0|1.0|0.0|0.0|https://freeglisse.com/64654-thickbox_default/ski-occasion-dynastar-speed-zone-4x4-78-fixations.jpg
https://freeglisse.com/fr/ski-occasion-adulte-performance/15497-177592-ski-occasion-lacroix-mach-1-fixations.html#/9-etat_du_materiel-qualite_b/912-taille_skis-170_cm|True|Ski occasion Lacroix Mach 1 + fixations|149.0|104.3|86.916667|['Accueil', 'Ski occasion', 'Occasion', 'Ski occasion adulte', 'Ski occasion adulte performance']|15497_p35_rouge|Rouge|Performant|Piste|Mixte|3.6|Ski occasion adulte performance|['Qualité B']|['156 cm', '170 cm']|Lacroix|6.0|kg|2025-01-31|False|"[""Mach est la ligne fondamentale de la gamme de ski Lacroix. Mach est un héritage, des années d'expérience et une demande constante de nombreuses générations de skieurs depuis 1967! Conçu pour des performances de slalom propres, le Mach 1 dispose d'une ligne de cotes de course et d'une construction basée sur le meilleur de la technologie Lacroix. Le résultat de cette combinaison est un ski à la fois puissant et stable, convertissant l'énergie du skieur en accélération explosive après chaque arc. Le Mach 1 est un ski pour ceux qui aiment diriger."", 'Lignes de Cotes: 125 -70 -109', 'Rayon de 12 m pour un ski de 165 cm', 'Prix neuf : 1300 €', 'Année : 2017', 'Fiche technique', 'Type', 'Piste', 'Utilisateur', 'Mixte', 'Niveau', 'Performant', 'Coloris', 'Rouge', 'Utilisateur - Configurateur', 'Adulte Performance', 'Economie de CO2 pour la planète (en kg)', '3.6', 'Type de produit', 'Ski occasion adulte performance', ""►\xa0État d'usure de nos skis et snowboards"", ""■ Qualité A : Matériel d'occasion en bon état"", ""Qualité A propose du matériel d'occasion ayant un bon état général, bien entretenu et pouvant être utilisé pendant de nombreuses saisons :"", 'Les qualités techniques et la durabilité du matériel sont excellentes', 'La sérigraphie peut également comporter quelques rayures et quelques accrocs', ""Fixations d'occasion en bon état (vérifiées par nos skimans) mais pouvant comporter cependant quelques rayures d'usage & quelque peu décolorées"", 'La semelle est parfaitement rebouchée, structurée et fartée. Les carres sont affûtées.', ""■ Qualité B : Matériel d'occasion en état correct"", ""La catégorie Qualité B possède du matériel d'occasion en état correct, mais présentant des marques d'usures plus prononcées (présence de rayures et d'accrocs) :"", 'La technicité et la durabilité du matériel restent bonnes malgré un esthétique plus ancien', ""Présence de rayures et d'accrocs plus prononcés sur plusieurs endroits de la sérigraphie, notamment au niveau de la spatule et du talon"", 'La fixation peut être rayée ou décolorée (toujours révisée par nos skimans)', 'La semelle est parfaitement rebouchée, structurée ainsi que fartée et les carres sont affûtées, comme pour le matériel de Qualité A', 'Prix attractif', '■ Qualité C : Matériel dont la sérigraphie est dégradée mais toujours performant', 'La catégorie Qualité C propose du matériel abîmé, dont la sérigraphie est dégradée mais qui reste skiable et performant :', ""Le matériel ayant déjà servi pendant plusieurs saisons, la sérigraphie est abimée et présente des traces plus importantes d'usures comme des rayures et des accrocs, mais qui n'a aucune influence sur la performance de celui-ci"", ""La fixation (toujours révisée par nos skimans) présente des traces d'usures plus importantes : décoloration, rayures, accrocs… Elle ne présente aucun danger pour l'utilisateur."", ""La semelle est parfaitement rebouchée, structurée et fartée. Les carres sont également affûtées, exactement comme les choix précédents. Attention : le matériel ayant déjà été bien utilisé, il ne reste plus beaucoup d'épaisseur de semelle ou de carre qui permettront de nouveaux entretiens."", 'Plus de détails sur la page\xa0état du matériel.', ""Voir l'attestation de confiance"", 'Avis soumis à un contrôle', ' ', ' ', "" Pour plus d'informations sur les caractéristiques du contrôle des avis et la possibilité de contacter l'auteur de l'avis, merci de consulter nos Charte de transparence."", "" Aucune contrepartie n'a été fournie en échange des avis"", ' Les avis sont publiés et conservés pendant une durée de cinq ans', "" Les avis ne sont pas modifiables : si un client souhaite modifier son avis, il doit contacter Avis Verifiés afin de supprimer l'avis existant, et en publier un nouveau"", ' Les motifs de suppression des avis sont disponibles ici.', '                  ', '               4.3 /5', ' ', ' ', '                Calculé à partir de   3  avis client(s)', '            ', '1', ' ', ' 0 ', '2', ' ', ' 0 ', '3', ' ', ' 0 ', '4', ' ', ' 2 ', '5', ' ', ' 1 ', ""Trier l'affichage des avis :"", '---', 'Les plus récents', 'Les plus anciens', 'Note la plus élevée', 'Note la plus faible', 'Les plus utiles ', '                                  Client anonyme', '               ', '               publié le 09/02/2023', 'suite à une commande du 02/02/2023', ' ', ' ', '                  4/5', '               ', '               Conforme alle attese, descritto in modo preciso', '            ', '                        Cet avis vous a-t-il été utile ?                        Oui 0', 'Non 0', '                                  Client anonyme', '               ', '               publié le 08/11/2021', 'suite à une commande du 01/11/2021', ' ', ' ', '                  4/5', '               ', '               Conforme', '            ', '                        Cet avis vous a-t-il été utile ?                        Oui 0', 'Non 0', '                                  Client anonyme', '               ', '               publié le 18/08/2021', 'suite à une commande du 11/08/2021', ' ', ' ', '                  5/5', '               ', '               Tres bon etat, conforme a mes attentes', '            ', '                        Cet avis vous a-t-il été utile ?                        Oui 0', 'Non 0', '×']"|4.3|3.0|0.0|0.0|0.0|2.0|1.0|https://freeglisse.com/44075-thickbox_default/ski-occasion-lacroix-mach-1-fixations.jpg
https://freeglisse.com/fr/ski-occasion-femme-all-mountain/18669-421721-ski-occasion-blizzard-black-pearl-82-sp-fixations.html#/901-taille_skis-159_cm/1768-etat_du_materiel-qualite_c|True|Ski occasion Blizzard Black Pearl 82 SP + fixations|169.0|99.0|82.5|['Ski occasion', 'Ski occasion femme', 'Occasion', 'Ski occasion femme all mountain']|18669_o02|Marron|Performant|All mountain|Femme|3.6|Ski occasion femme all mountain|['Qualité C']|['159 cm', '166 cm', '173 cm']|Blizzard|6.0|kg|2025-01-31|False|"[""Il reprend la construction du 88: noyau bois, Carbon Flipcore W.S.D. adaptés aux femme. Plus vif, plus insisif, il apportera stabilité, performance et confiance dans tout type de terrain. De construction légère, c'est le ski idéal pour les skieuses de haut niveau ou pour celles qui souhaitent progresser en toute confiance."", 'Lignes de cote: 121/82/105', 'Rayon : 17m pour un ski en 173cm', 'Année : 2020', 'Prix neuf nu : 500€', 'Fiche technique', 'Type', 'All mountain', 'Utilisateur', 'Femme', 'Niveau', 'Performant', 'Coloris', 'Marron', 'Economie de CO2 pour la planète (en kg)', '3.6', 'Type de produit', 'Ski occasion femme all mountain', ""►\xa0État d'usure de nos skis et snowboards"", ""■ Qualité A : Matériel d'occasion en bon état"", ""Qualité A propose du matériel d'occasion ayant un bon état général, bien entretenu et pouvant être utilisé pendant de nombreuses saisons :"", 'Les qualités techniques et la durabilité du matériel sont excellentes', 'La sérigraphie peut également comporter quelques rayures et quelques accrocs', ""Fixations d'occasion en bon état (vérifiées par nos skimans) mais pouvant comporter cependant quelques rayures d'usage & quelque peu décolorées"", 'La semelle est parfaitement rebouchée, structurée et fartée. Les carres sont affûtées.', ""■ Qualité B : Matériel d'occasion en état correct"", ""La catégorie Qualité B possède du matériel d'occasion en état correct, mais présentant des marques d'usures plus prononcées (présence de rayures et d'accrocs) :"", 'La technicité et la durabilité du matériel restent bonnes malgré un esthétique plus ancien', ""Présence de rayures et d'accrocs plus prononcés sur plusieurs endroits de la sérigraphie, notamment au niveau de la spatule et du talon"", 'La fixation peut être rayée ou décolorée (toujours révisée par nos skimans)', 'La semelle est parfaitement rebouchée, structurée ainsi que fartée et les carres sont affûtées, comme pour le matériel de Qualité A', 'Prix attractif', '■ Qualité C : Matériel dont la sérigraphie est dégradée mais toujours performant', 'La catégorie Qualité C propose du matériel abîmé, dont la sérigraphie est dégradée mais qui reste skiable et performant :', ""Le matériel ayant déjà servi pendant plusieurs saisons, la sérigraphie est abimée et présente des traces plus importantes d'usures comme des rayures et des accrocs, mais qui n'a aucune influence sur la performance de celui-ci"", ""La fixation (toujours révisée par nos skimans) présente des traces d'usures plus importantes : décoloration, rayures, accrocs… Elle ne présente aucun danger pour l'utilisateur."", ""La semelle est parfaitement rebouchée, structurée et fartée. Les carres sont également affûtées, exactement comme les choix précédents. Attention : le matériel ayant déjà été bien utilisé, il ne reste plus beaucoup d'épaisseur de semelle ou de carre qui permettront de nouveaux entretiens."", 'Plus de détails sur la page\xa0état du matériel.', ""Voir l'attestation de confiance"", 'Avis soumis à un contrôle', ' ', ' ', "" Pour plus d'informations sur les caractéristiques du contrôle des avis et la possibilité de contacter l'auteur de l'avis, merci de consulter nos Charte de transparence."", "" Aucune contrepartie n'a été fournie en échange des avis"", ' Les avis sont publiés et conservés pendant une durée de cinq ans', "" Les avis ne sont pas modifiables : si un client souhaite modifier son avis, il doit contacter Avis Verifiés afin de supprimer l'avis existant, et en publier un nouveau"", ' Les motifs de suppression des avis sont disponibles ici.', '                  ', '               5 /5', ' ', ' ', '                Calculé à partir de   1  avis client(s)', '            ', '1', ' ', ' 0 ', '2', ' ', ' 0 ', '3', ' ', ' 0 ', '4', ' ', ' 0 ', '5', ' ', ' 1 ', ""Trier l'affichage des avis :"", '---', 'Les plus récents', 'Les plus anciens', 'Note la plus élevée', 'Note la plus faible', 'Les plus utiles ', '                                  Charlotte B.', '               ', '               publié le 01/01/2024', 'suite à une commande du 03/12/2023', ' ', ' ', '                  5/5', '               ', ""               Rapport qualité/prix très bien, il ne faut pas avoir peur de la qualité C, usée sur le plastique dessus avec éclat, mais les quarts et le fartage était niquel! le plastique du dessus à part pour le côté esthétique on s'en fiche un peu. Skis plus large, polyvalent, je suis très satisfaite de mon achat!!"", '            ', '                        Cet avis vous a-t-il été utile ?                        Oui 0', 'Non 0', '×']"|5.0|1.0|0.0|0.0|0.0|0.0|1.0|https://freeglisse.com/69024-thickbox_default/ski-occasion-blizzard-black-pearl-82-sp-fixations.jpg
