url|available|name|reg_price|current_price|pretax_price|cats|ref|color|level|type|user_type|co2_eco|product_type|quality|size|brand|weight|weight_type|price_valid_date|page_has_issues|desc|rating|nb_rating|rate_1|rate_2|rate_3|rate_4|rate_5|img
https://freeglisse.com/fr/ski-occasion-junior-loisir/11469-84188-ski-occasion-junior-elan-exar-pro-fixations.html#/3-etat_du_materiel-qualite_a/822-taille_skis-80_cm|True|Ski occasion junior Elan Exar pro + fixations|379.0|49.0|40.833333|['Ski occasion', 'Ski occasion junior', 'Occasion', 'Ski occasion junior loisir']|11469_c06_vert|Vert|Débutant|Piste|Junior|3.6|Ski occasion junior loisir|['Qualité A']|['70 cm', '80 cm']|Elan|6.0|kg|2025-01-31|False|"[""Le Elan Exar pro est l'outil parfait pour apprendre aux plus petits les joies de la neige. Des technologies adaptées aux besoins des plus jeunes, une garantie de leur faire apprécier leurs premières expériences sur les skis."", 'Attention : coloris variable selon la taille des skis', '(Pour un ski de 150cm -> Orange', 'Pour un ski de 140cm -> Jaune', 'Pour un ski de 130cm -> Vert', 'Pour un ski de 120cm -> Bleu', 'Pour un ski de 110cm -> Bleu foncé', 'Pour un ski de 70 cm-100cm -> Vert', 'Pour un ski de 90cm -> Orange', 'Pour un ski de 80cm -> Jaune)', 'Lignes de cote : 97 66 88', 'Rayon de 8.1 m pour un ski de 110 cm', 'Année: 2012', 'Fiche technique', 'Type', 'Piste', 'Utilisateur', 'Junior', 'Niveau', 'Débutant', 'Coloris', 'Vert', 'Utilisateur - Configurateur', 'un junior', 'Economie de CO2 pour la planète (en kg)', '3.6', 'Type de produit', 'Ski occasion junior loisir', ""►\xa0État d'usure de nos skis et snowboards"", ""■ Qualité A : Matériel d'occasion en bon état"", ""Qualité A propose du matériel d'occasion ayant un bon état général, bien entretenu et pouvant être utilisé pendant de nombreuses saisons :"", 'Les qualités techniques et la durabilité du matériel sont excellentes', 'La sérigraphie peut également comporter quelques rayures et quelques accrocs', ""Fixations d'occasion en bon état (vérifiées par nos skimans) mais pouvant comporter cependant quelques rayures d'usage & quelque peu décolorées"", 'La semelle est parfaitement rebouchée, structurée et fartée. Les carres sont affûtées.', ""■ Qualité B : Matériel d'occasion en état correct"", ""La catégorie Qualité B possède du matériel d'occasion en état correct, mais présentant des marques d'usures plus prononcées (présence de rayures et d'accrocs) :"", 'La technicité et la durabilité du matériel restent bonnes malgré un esthétique plus ancien', ""Présence de rayures et d'accrocs plus prononcés sur plusieurs endroits de la sérigraphie, notamment au niveau de la spatule et du talon"", 'La fixation peut être rayée ou décolorée (toujours révisée par nos skimans)', 'La semelle est parfaitement rebouchée, structurée ainsi que fartée et les carres sont affûtées, comme pour le matériel de Qualité A', 'Prix attractif', '■ Qualité C : Matériel dont la sérigraphie est dégradée mais toujours performant', 'La catégorie Qualité C propose du matériel abîmé, dont la sérigraphie est dégradée mais qui reste skiable et performant :', ""Le matériel ayant déjà servi pendant plusieurs saisons, la sérigraphie est abimée et présente des traces plus importantes d'usures comme des rayures et des accrocs, mais qui n'a aucune influence sur la performance de celui-ci"", ""La fixation (toujours révisée par nos skimans) présente des traces d'usures plus importantes : décoloration, rayures, accrocs… Elle ne présente aucun danger pour l'utilisateur."", ""La semelle est parfaitement rebouchée, structurée et fartée. Les carres sont également affûtées, exactement comme les choix précédents. Attention : le matériel ayant déjà été bien utilisé, il ne reste plus beaucoup d'épaisseur de semelle ou de carre qui permettront de nouveaux entretiens."", 'Plus de détails sur la page\xa0état du matériel.', ""Voir l'attestation de confiance"", 'Avis soumis à un contrôle', ' ', ' ', "" Pour plus d'informations sur les caractéristiques du contrôle des avis et la possibilité de contacter l'auteur de l'avis, merci de consulter nos Charte de transparence."", "" Aucune contrepartie n'a été fournie en échange des avis"", ' Les avis sont publiés et conservés pendant une durée de cinq ans', "" Les avis ne sont pas modifiables : si un client souhaite modifier son avis, il doit contacter Avis Verifiés afin de supprimer l'avis existant, et en publier un nouveau"", ' Les motifs de suppression des avis sont disponibles ici.', '                  ', '               4 /5', ' ', ' ', '                Calculé à partir de   1  avis client(s)', '            ', '1', ' ', ' 0 ', '2', ' ', ' 0 ', '3', ' ', ' 0 ', '4', ' ', ' 1 ', '5', ' ', ' 0 ', ""Trier l'affichage des avis :"", '---', 'Les plus récents', 'Les plus anciens', 'Note la plus élevée', 'Note la plus faible', 'Les plus utiles ', '                                  Client anonyme', '               ', '               publié le 22/01/2022', 'suite à une commande du 16/01/2022', ' ', ' ', '                  4/5', '               ', '               conforme a mon attente', '            ', '                        Cet avis vous a-t-il été utile ?                        Oui 0', 'Non 0', '×']"|4.0|1.0|0.0|0.0|0.0|1.0|0.0|https://freeglisse.com/28663-thickbox_default/ski-occasion-junior-elan-exar-pro-fixations.jpg
https://freeglisse.com/fr/ski-occasion-adulte-performance/18563-418886-ski-occasion-fischer-rc-one-77-xtr-fixations.html#/3-etat_du_materiel-qualite_a/899-taille_skis-157_cm|True|Ski occasion Fischer Rc One 77 XTR + fixations|349.0|149.0|124.166667|['Ski occasion', 'Occasion', 'Ski occasion adulte', 'Ski occasion adulte performance']|18563_j23_bleu|Bleu|Performant|Piste|Mixte|3.6|Ski occasion adulte performance|['Qualité A', 'Qualité B', 'Qualité C']|['157 cm']|Fischer|6.0|kg|2025-01-31|False|"['Ski performance de Fischer pour progresser en toute facilité afin de descendre les pistes et affronter tout types de conditions de neige.', 'Ligne de cotes : 120-76-103', 'Rayon de 13.3m pour un ski de 151cm', 'Fiche technique', 'Type', 'Piste', 'Utilisateur', 'Mixte', 'Niveau', 'Performant', 'Coloris', 'Bleu', 'Economie de CO2 pour la planète (en kg)', '3.6', 'Type de produit', 'Ski occasion adulte performance', ""►\xa0État d'usure de nos skis et snowboards"", ""■ Qualité A : Matériel d'occasion en bon état"", ""Qualité A propose du matériel d'occasion ayant un bon état général, bien entretenu et pouvant être utilisé pendant de nombreuses saisons :"", 'Les qualités techniques et la durabilité du matériel sont excellentes', 'La sérigraphie peut également comporter quelques rayures et quelques accrocs', ""Fixations d'occasion en bon état (vérifiées par nos skimans) mais pouvant comporter cependant quelques rayures d'usage & quelque peu décolorées"", 'La semelle est parfaitement rebouchée, structurée et fartée. Les carres sont affûtées.', ""■ Qualité B : Matériel d'occasion en état correct"", ""La catégorie Qualité B possède du matériel d'occasion en état correct, mais présentant des marques d'usures plus prononcées (présence de rayures et d'accrocs) :"", 'La technicité et la durabilité du matériel restent bonnes malgré un esthétique plus ancien', ""Présence de rayures et d'accrocs plus prononcés sur plusieurs endroits de la sérigraphie, notamment au niveau de la spatule et du talon"", 'La fixation peut être rayée ou décolorée (toujours révisée par nos skimans)', 'La semelle est parfaitement rebouchée, structurée ainsi que fartée et les carres sont affûtées, comme pour le matériel de Qualité A', 'Prix attractif', '■ Qualité C : Matériel dont la sérigraphie est dégradée mais toujours performant', 'La catégorie Qualité C propose du matériel abîmé, dont la sérigraphie est dégradée mais qui reste skiable et performant :', ""Le matériel ayant déjà servi pendant plusieurs saisons, la sérigraphie est abimée et présente des traces plus importantes d'usures comme des rayures et des accrocs, mais qui n'a aucune influence sur la performance de celui-ci"", ""La fixation (toujours révisée par nos skimans) présente des traces d'usures plus importantes : décoloration, rayures, accrocs… Elle ne présente aucun danger pour l'utilisateur."", ""La semelle est parfaitement rebouchée, structurée et fartée. Les carres sont également affûtées, exactement comme les choix précédents. Attention : le matériel ayant déjà été bien utilisé, il ne reste plus beaucoup d'épaisseur de semelle ou de carre qui permettront de nouveaux entretiens."", 'Plus de détails sur la page\xa0état du matériel.', ""Voir l'attestation de confiance"", 'Avis soumis à un contrôle', ' ', ' ', "" Pour plus d'informations sur les caractéristiques du contrôle des avis et la possibilité de contacter l'auteur de l'avis, merci de consulter nos Charte de transparence."", "" Aucune contrepartie n'a été fournie en échange des avis"", ' Les avis sont publiés et conservés pendant une durée de cinq ans', "" Les avis ne sont pas modifiables : si un client souhaite modifier son avis, il doit contacter Avis Verifiés afin de supprimer l'avis existant, et en publier un nouveau"", ' Les motifs de suppression des avis sont disponibles ici.', '                  ', '               5 /5', ' ', ' ', '                Calculé à partir de   1  avis client(s)', '            ', '1', ' ', ' 0 ', '2', ' ', ' 0 ', '3', ' ', ' 0 ', '4', ' ', ' 0 ', '5', ' ', ' 1 ', ""Trier l'affichage des avis :"", '---', 'Les plus récents', 'Les plus anciens', 'Note la plus élevée', 'Note la plus faible', 'Les plus utiles ', '                                  Angel Jesús S.', '               ', '               publié le 12/12/2024', 'suite à une commande du 29/11/2024', ' ', ' ', '                  5/5', '               ', '               Están genial', '            ', '                        Cet avis vous a-t-il été utile ?                        Oui 0', 'Non 0', '×']"|5.0|1.0|0.0|0.0|0.0|0.0|1.0|https://freeglisse.com/68691-thickbox_default/ski-occasion-fischer-rc-one-77-xtr-fixations.jpg
https://freeglisse.com/fr/ski-occasion-junior-loisir/11597-85939-ski-occasion-junior-k2-indy-fixations.html#/3-etat_du_materiel-qualite_a/818-taille_skis-76_cm|True|Ski occasion junior K2 indy + fixations|349.0|59.0|49.166667|['Ski occasion', 'Ski occasion junior', 'Occasion', 'Ski occasion junior loisir']|11597_c39_violet|Violet|Loisir|All mountain|Mixte|3.6|Ski occasion junior loisir|['Qualité A', 'Qualité B']|['76 cm', '112 cm']|K2|6.0|kg|2025-01-31|False|"['L’Indy est fait pour les jeunes skieurs débutants. Le profil Catch-Free Rocker apporte une bonne tenue de carre sur neige damée et le patin de 70 mm rend le ski léger et maniable. Grâce à la technologie Noodle, le flex de l’Indy est idéal pour les juniors, leur permettant ainsi de fléchir leurs skis comme leurs parents.', 'Ligne de cotes : 89 70 84', 'Rayon de 8 m pour un ski de 112 cm', 'Année : 2011', 'Prix neuf : 129 €', 'Fiche technique', 'Type', 'All mountain', 'Utilisateur', 'Mixte', 'Niveau', 'Loisir', 'Coloris', 'Violet', 'Economie de CO2 pour la planète (en kg)', '3.6', 'Type de produit', 'Ski occasion junior loisir', ""►\xa0État d'usure de nos skis et snowboards"", ""■ Qualité A : Matériel d'occasion en bon état"", ""Qualité A propose du matériel d'occasion ayant un bon état général, bien entretenu et pouvant être utilisé pendant de nombreuses saisons :"", 'Les qualités techniques et la durabilité du matériel sont excellentes', 'La sérigraphie peut également comporter quelques rayures et quelques accrocs', ""Fixations d'occasion en bon état (vérifiées par nos skimans) mais pouvant comporter cependant quelques rayures d'usage & quelque peu décolorées"", 'La semelle est parfaitement rebouchée, structurée et fartée. Les carres sont affûtées.', ""■ Qualité B : Matériel d'occasion en état correct"", ""La catégorie Qualité B possède du matériel d'occasion en état correct, mais présentant des marques d'usures plus prononcées (présence de rayures et d'accrocs) :"", 'La technicité et la durabilité du matériel restent bonnes malgré un esthétique plus ancien', ""Présence de rayures et d'accrocs plus prononcés sur plusieurs endroits de la sérigraphie, notamment au niveau de la spatule et du talon"", 'La fixation peut être rayée ou décolorée (toujours révisée par nos skimans)', 'La semelle est parfaitement rebouchée, structurée ainsi que fartée et les carres sont affûtées, comme pour le matériel de Qualité A', 'Prix attractif', '■ Qualité C : Matériel dont la sérigraphie est dégradée mais toujours performant', 'La catégorie Qualité C propose du matériel abîmé, dont la sérigraphie est dégradée mais qui reste skiable et performant :', ""Le matériel ayant déjà servi pendant plusieurs saisons, la sérigraphie est abimée et présente des traces plus importantes d'usures comme des rayures et des accrocs, mais qui n'a aucune influence sur la performance de celui-ci"", ""La fixation (toujours révisée par nos skimans) présente des traces d'usures plus importantes : décoloration, rayures, accrocs… Elle ne présente aucun danger pour l'utilisateur."", ""La semelle est parfaitement rebouchée, structurée et fartée. Les carres sont également affûtées, exactement comme les choix précédents. Attention : le matériel ayant déjà été bien utilisé, il ne reste plus beaucoup d'épaisseur de semelle ou de carre qui permettront de nouveaux entretiens."", 'Plus de détails sur la page\xa0état du matériel.', ""Voir l'attestation de confiance"", 'Avis soumis à un contrôle', ' ', ' ', "" Pour plus d'informations sur les caractéristiques du contrôle des avis et la possibilité de contacter l'auteur de l'avis, merci de consulter nos Charte de transparence."", "" Aucune contrepartie n'a été fournie en échange des avis"", ' Les avis sont publiés et conservés pendant une durée de cinq ans', "" Les avis ne sont pas modifiables : si un client souhaite modifier son avis, il doit contacter Avis Verifiés afin de supprimer l'avis existant, et en publier un nouveau"", ' Les motifs de suppression des avis sont disponibles ici.', '                  ', '               4.5 /5', ' ', ' ', '                Calculé à partir de   2  avis client(s)', '            ', '1', ' ', ' 0 ', '2', ' ', ' 0 ', '3', ' ', ' 0 ', '4', ' ', ' 1 ', '5', ' ', ' 1 ', ""Trier l'affichage des avis :"", '---', 'Les plus récents', 'Les plus anciens', 'Note la plus élevée', 'Note la plus faible', 'Les plus utiles ', '                                  Client anonyme', '               ', '               publié le 27/12/2022', 'suite à une commande du 16/12/2022', ' ', ' ', '                  5/5', '               ', '               RAS.', '            ', '                        Cet avis vous a-t-il été utile ?                        Oui 0', 'Non 0', '                                  Client anonyme', '               ', '               publié le 24/12/2019', 'suite à une commande du 09/12/2019', ' ', ' ', '                  4/5', '               ', '               Conformes', '            ', '                        Cet avis vous a-t-il été utile ?                        Oui 0', 'Non 0', '×']"|4.5|2.0|0.0|0.0|0.0|1.0|1.0|https://freeglisse.com/29139-thickbox_default/ski-occasion-junior-k2-indy-fixations.jpg
https://freeglisse.com/fr/ski-occasion-junior-loisir/12467-517841-ski-occasion-junior-tecnopro-flyte-xt-fixations.html#/3-etat_du_materiel-qualite_a/842-taille_skis-100_cm|True|Ski occasion junior Tecnopro Flyte XT + fixations|349.0|55.0|45.833333|['Ski occasion', 'Ski occasion junior', 'Occasion', 'Ski occasion junior loisir']|12467_b08_beige|Beige|Loisir|All mountain|Junior|3.6|Ski occasion junior loisir|['Qualité A', 'Qualité B']|['100 cm', '110 cm', '120 cm', '130 cm']|Tecnopro|6.0|kg|2025-01-31|False|"['Le Tecno Pro Flyte XT est conseillé aux enfants de niveau intermédiaire pour continuer de développer leur capacités à skier.Efficace sur piste, il est aussi très tolérant et facile à manier. Pour ceux qui veulent un bon ski pour progresser et skier comme les grands.', 'Lignes de cotes : 97 66 88', 'Rayon de 8.1 m pour un ski de 110 cm', 'Fiche technique', 'Type', 'All mountain', 'Utilisateur', 'Junior', 'Niveau', 'Loisir', 'Coloris', 'Beige', 'Economie de CO2 pour la planète (en kg)', '3.6', 'Type de produit', 'Ski occasion junior loisir', ""►\xa0État d'usure de nos skis et snowboards"", ""■ Qualité A : Matériel d'occasion en bon état"", ""Qualité A propose du matériel d'occasion ayant un bon état général, bien entretenu et pouvant être utilisé pendant de nombreuses saisons :"", 'Les qualités techniques et la durabilité du matériel sont excellentes', 'La sérigraphie peut également comporter quelques rayures et quelques accrocs', ""Fixations d'occasion en bon état (vérifiées par nos skimans) mais pouvant comporter cependant quelques rayures d'usage & quelque peu décolorées"", 'La semelle est parfaitement rebouchée, structurée et fartée. Les carres sont affûtées.', ""■ Qualité B : Matériel d'occasion en état correct"", ""La catégorie Qualité B possède du matériel d'occasion en état correct, mais présentant des marques d'usures plus prononcées (présence de rayures et d'accrocs) :"", 'La technicité et la durabilité du matériel restent bonnes malgré un esthétique plus ancien', ""Présence de rayures et d'accrocs plus prononcés sur plusieurs endroits de la sérigraphie, notamment au niveau de la spatule et du talon"", 'La fixation peut être rayée ou décolorée (toujours révisée par nos skimans)', 'La semelle est parfaitement rebouchée, structurée ainsi que fartée et les carres sont affûtées, comme pour le matériel de Qualité A', 'Prix attractif', '■ Qualité C : Matériel dont la sérigraphie est dégradée mais toujours performant', 'La catégorie Qualité C propose du matériel abîmé, dont la sérigraphie est dégradée mais qui reste skiable et performant :', ""Le matériel ayant déjà servi pendant plusieurs saisons, la sérigraphie est abimée et présente des traces plus importantes d'usures comme des rayures et des accrocs, mais qui n'a aucune influence sur la performance de celui-ci"", ""La fixation (toujours révisée par nos skimans) présente des traces d'usures plus importantes : décoloration, rayures, accrocs… Elle ne présente aucun danger pour l'utilisateur."", ""La semelle est parfaitement rebouchée, structurée et fartée. Les carres sont également affûtées, exactement comme les choix précédents. Attention : le matériel ayant déjà été bien utilisé, il ne reste plus beaucoup d'épaisseur de semelle ou de carre qui permettront de nouveaux entretiens."", 'Plus de détails sur la page\xa0état du matériel.', ""Voir l'attestation de confiance"", 'Avis soumis à un contrôle', ' ', ' ', "" Pour plus d'informations sur les caractéristiques du contrôle des avis et la possibilité de contacter l'auteur de l'avis, merci de consulter nos Charte de transparence."", "" Aucune contrepartie n'a été fournie en échange des avis"", ' Les avis sont publiés et conservés pendant une durée de cinq ans', "" Les avis ne sont pas modifiables : si un client souhaite modifier son avis, il doit contacter Avis Verifiés afin de supprimer l'avis existant, et en publier un nouveau"", ' Les motifs de suppression des avis sont disponibles ici.', '                  ', '               4.7 /5', ' ', ' ', '                Calculé à partir de   3  avis client(s)', '            ', '1', ' ', ' 0 ', '2', ' ', ' 0 ', '3', ' ', ' 0 ', '4', ' ', ' 1 ', '5', ' ', ' 2 ', ""Trier l'affichage des avis :"", '---', 'Les plus récents', 'Les plus anciens', 'Note la plus élevée', 'Note la plus faible', 'Les plus utiles ', '                                  Virginie G.', '               ', '               publié le 24/01/2024', 'suite à une commande du 28/12/2023', ' ', ' ', '                  5/5', '               ', '               Les ski sont propre.', '            ', '                        Cet avis vous a-t-il été utile ?                        Oui 0', 'Non 0', '                                  Marielle D.', '               ', '               publié le 16/12/2023', 'suite à une commande du 01/12/2023', ' ', ' ', '                  5/5', '               ', '               conforme. très bon rapport qualité/prix', '            ', '                        Cet avis vous a-t-il été utile ?                        Oui 0', 'Non 0', '                                  Client anonyme', '               ', '               publié le 11/02/2020', 'suite à une commande du 04/02/2020', ' ', ' ', '                  4/5', '               ', '               Très bon état', '            ', '                        Cet avis vous a-t-il été utile ?                        Oui 0', 'Non 0', '×']"|4.7|3.0|0.0|0.0|0.0|1.0|2.0|https://freeglisse.com/27006-thickbox_default/ski-occasion-junior-tecnopro-flyte-xt-fixations.jpg
