url|available|name|reg_price|current_price|pretax_price|cats|ref|color|level|type|user_type|co2_eco|product_type|quality|size|brand|weight|weight_type|price_valid_date|page_has_issues|desc|rating|nb_rating|rate_1|rate_2|rate_3|rate_4|rate_5|img
https://freeglisse.com/fr/ski-occasion-femme-loisir/12897-416449-ski-occasion-dynastar-exclusive-active-fixations.html#/3-etat_du_materiel-qualite_a/910-taille_skis-168_cm|True|Ski occasion Dynastar Exclusive Active + fixations|489.0|99.0|82.5|['Ski occasion', 'Ski occasion femme', 'Occasion', 'Ski occasion femme loisir']|12897_m17|Blanc|Débutant|Piste|Femme|3.6|Ski occasion femme loisir|['Qualité A']|['168 cm']|Dynastar|6.0|kg|2025-01-31|False|"['Facilité de déclenchement: Rocker en spatule. Contact ski/neige doux : Lignes de cote modernes et progressives. Maneuvrabilité: légèreté et grip de portage', 'Lignes de cotes: 126-74-104', 'Rayon de 13m pour un ski de 163cm', 'Année: 2013', 'Prix neuf: 399 €', 'Fiche technique', 'Type', 'Piste', 'Utilisateur', 'Femme', 'Niveau', 'Débutant', 'Coloris', 'Blanc', 'Economie de CO2 pour la planète (en kg)', '3.6', 'Type de produit', 'Ski occasion femme loisir', ""►\xa0État d'usure de nos skis et snowboards"", ""■ Qualité A : Matériel d'occasion en bon état"", ""Qualité A propose du matériel d'occasion ayant un bon état général, bien entretenu et pouvant être utilisé pendant de nombreuses saisons :"", 'Les qualités techniques et la durabilité du matériel sont excellentes', 'La sérigraphie peut également comporter quelques rayures et quelques accrocs', ""Fixations d'occasion en bon état (vérifiées par nos skimans) mais pouvant comporter cependant quelques rayures d'usage & quelque peu décolorées"", 'La semelle est parfaitement rebouchée, structurée et fartée. Les carres sont affûtées.', ""■ Qualité B : Matériel d'occasion en état correct"", ""La catégorie Qualité B possède du matériel d'occasion en état correct, mais présentant des marques d'usures plus prononcées (présence de rayures et d'accrocs) :"", 'La technicité et la durabilité du matériel restent bonnes malgré un esthétique plus ancien', ""Présence de rayures et d'accrocs plus prononcés sur plusieurs endroits de la sérigraphie, notamment au niveau de la spatule et du talon"", 'La fixation peut être rayée ou décolorée (toujours révisée par nos skimans)', 'La semelle est parfaitement rebouchée, structurée ainsi que fartée et les carres sont affûtées, comme pour le matériel de Qualité A', 'Prix attractif', '■ Qualité C : Matériel dont la sérigraphie est dégradée mais toujours performant', 'La catégorie Qualité C propose du matériel abîmé, dont la sérigraphie est dégradée mais qui reste skiable et performant :', ""Le matériel ayant déjà servi pendant plusieurs saisons, la sérigraphie est abimée et présente des traces plus importantes d'usures comme des rayures et des accrocs, mais qui n'a aucune influence sur la performance de celui-ci"", ""La fixation (toujours révisée par nos skimans) présente des traces d'usures plus importantes : décoloration, rayures, accrocs… Elle ne présente aucun danger pour l'utilisateur."", ""La semelle est parfaitement rebouchée, structurée et fartée. Les carres sont également affûtées, exactement comme les choix précédents. Attention : le matériel ayant déjà été bien utilisé, il ne reste plus beaucoup d'épaisseur de semelle ou de carre qui permettront de nouveaux entretiens."", 'Plus de détails sur la page\xa0état du matériel.', ""Voir l'attestation de confiance"", 'Avis soumis à un contrôle', ' ', ' ', "" Pour plus d'informations sur les caractéristiques du contrôle des avis et la possibilité de contacter l'auteur de l'avis, merci de consulter nos Charte de transparence."", "" Aucune contrepartie n'a été fournie en échange des avis"", ' Les avis sont publiés et conservés pendant une durée de cinq ans', "" Les avis ne sont pas modifiables : si un client souhaite modifier son avis, il doit contacter Avis Verifiés afin de supprimer l'avis existant, et en publier un nouveau"", ' Les motifs de suppression des avis sont disponibles ici.', '                  ', '               3.7 /5', ' ', ' ', '                Calculé à partir de   3  avis client(s)', '            ', '1', ' ', ' 0 ', '2', ' ', ' 0 ', '3', ' ', ' 2 ', '4', ' ', ' 0 ', '5', ' ', ' 1 ', ""Trier l'affichage des avis :"", '---', 'Les plus récents', 'Les plus anciens', 'Note la plus élevée', 'Note la plus faible', 'Les plus utiles ', '                                  Client anonyme', '               ', '               publié le 15/10/2020', 'suite à une commande du 04/10/2020', ' ', ' ', '                  3/5', '               ', '               Pour une catégorie A, plusieurs trous sur le dos des skis. Par contre semelles et les carres sont corrects', '            ', '                        Cet avis vous a-t-il été utile ?                        Oui 0', 'Non 0', '                                  Client anonyme', '               ', '               publié le 28/01/2020', 'suite à une commande du 21/01/2020', ' ', ' ', '                  3/5', '               ', '               Correct.', '            ', '                        Cet avis vous a-t-il été utile ?                        Oui 0', 'Non 0', '                                  Client anonyme', '               ', '               publié le 21/01/2020', 'suite à une commande du 09/01/2020', ' ', ' ', '                  5/5', '               ', '               Très heureusement surprise pour un deuxième choix...la semelle est top', '            ', '                        Cet avis vous a-t-il été utile ?                        Oui 0', 'Non 0', '×']"|3.7|3.0|0.0|0.0|2.0|0.0|1.0|https://freeglisse.com/31216-thickbox_default/ski-occasion-dynastar-exclusive-active-fixations.jpg
https://freeglisse.com/fr/ski-occasion-freeride/14644-497465-ski-occasion-dynastar-cham-87-fixations.html#/3-etat_du_materiel-qualite_a/914-taille_skis-172_cm|True|Ski occasion Dynastar Cham 87 + fixations|489.0|139.0|115.833333|['Ski occasion', 'Occasion', 'Ski occasion adulte freeride et freestyle', 'Ski occasion freeride']|14644_e10_orange|Orange|Performant|Freeride|Mixte|3.6|Ski occasion freeride|['Qualité A']|['172 cm']|Dynastar|6.0|kg|2025-01-31|False|"[""Le Cham 87 s'adresse au skieur intermédiaire et au bon skieur à la cherche d'un ski de freeride polyvalent, aussi bien performant sur la piste qu'en hors-piste. Ce ski aux lignes de cotes inversées en spatule et talon est très maniable. Il se comporte de manière très fluide sur la piste et très souple dans la poudreuse. Sur tout type de neige, même dure, vous pourrez enchaîner les virages serrés et les courbes allongées avec aisance."", 'Ligne de cotes 127 87 103', 'Rayon de 16 m pour un ski en 172 cm', 'Prix neuf : 499 €', 'Année : 2014', 'Fiche technique', 'Type', 'Freeride', 'Utilisateur', 'Mixte', 'Niveau', 'Performant', 'Coloris', 'Orange', 'Economie de CO2 pour la planète (en kg)', '3.6', 'Type de produit', 'Ski occasion freeride', ""►\xa0État d'usure de nos skis et snowboards"", ""■ Qualité A : Matériel d'occasion en bon état"", ""Qualité A propose du matériel d'occasion ayant un bon état général, bien entretenu et pouvant être utilisé pendant de nombreuses saisons :"", 'Les qualités techniques et la durabilité du matériel sont excellentes', 'La sérigraphie peut également comporter quelques rayures et quelques accrocs', ""Fixations d'occasion en bon état (vérifiées par nos skimans) mais pouvant comporter cependant quelques rayures d'usage & quelque peu décolorées"", 'La semelle est parfaitement rebouchée, structurée et fartée. Les carres sont affûtées.', ""■ Qualité B : Matériel d'occasion en état correct"", ""La catégorie Qualité B possède du matériel d'occasion en état correct, mais présentant des marques d'usures plus prononcées (présence de rayures et d'accrocs) :"", 'La technicité et la durabilité du matériel restent bonnes malgré un esthétique plus ancien', ""Présence de rayures et d'accrocs plus prononcés sur plusieurs endroits de la sérigraphie, notamment au niveau de la spatule et du talon"", 'La fixation peut être rayée ou décolorée (toujours révisée par nos skimans)', 'La semelle est parfaitement rebouchée, structurée ainsi que fartée et les carres sont affûtées, comme pour le matériel de Qualité A', 'Prix attractif', '■ Qualité C : Matériel dont la sérigraphie est dégradée mais toujours performant', 'La catégorie Qualité C propose du matériel abîmé, dont la sérigraphie est dégradée mais qui reste skiable et performant :', ""Le matériel ayant déjà servi pendant plusieurs saisons, la sérigraphie est abimée et présente des traces plus importantes d'usures comme des rayures et des accrocs, mais qui n'a aucune influence sur la performance de celui-ci"", ""La fixation (toujours révisée par nos skimans) présente des traces d'usures plus importantes : décoloration, rayures, accrocs… Elle ne présente aucun danger pour l'utilisateur."", ""La semelle est parfaitement rebouchée, structurée et fartée. Les carres sont également affûtées, exactement comme les choix précédents. Attention : le matériel ayant déjà été bien utilisé, il ne reste plus beaucoup d'épaisseur de semelle ou de carre qui permettront de nouveaux entretiens."", 'Plus de détails sur la page\xa0état du matériel.', ""Voir l'attestation de confiance"", 'Avis soumis à un contrôle', ' ', ' ', "" Pour plus d'informations sur les caractéristiques du contrôle des avis et la possibilité de contacter l'auteur de l'avis, merci de consulter nos Charte de transparence."", "" Aucune contrepartie n'a été fournie en échange des avis"", ' Les avis sont publiés et conservés pendant une durée de cinq ans', "" Les avis ne sont pas modifiables : si un client souhaite modifier son avis, il doit contacter Avis Verifiés afin de supprimer l'avis existant, et en publier un nouveau"", ' Les motifs de suppression des avis sont disponibles ici.', '                  ', '               3 /5', ' ', ' ', '                Calculé à partir de   2  avis client(s)', '            ', '1', ' ', ' 0 ', '2', ' ', ' 0 ', '3', ' ', ' 2 ', '4', ' ', ' 0 ', '5', ' ', ' 0 ', ""Trier l'affichage des avis :"", '---', 'Les plus récents', 'Les plus anciens', 'Note la plus élevée', 'Note la plus faible', 'Les plus utiles ', '                                  Client anonyme', '               ', '               publié le 07/02/2022', 'suite à une commande du 26/01/2022', ' ', ' ', '                  3/5', '               ', ""               -Manque d'informations plus précise sur l'état général du matériel sur le site, juste un récapitulatif généralisé sur la notation A,B et C.\r"", ""-A réception j'aurai plutôt mis la lettre B (A sur le site), semelle et care OK, fixation et dessus de ski avec bon nombres de rayures. Maintenant c'est qu'à 'usage que je verrais si c'est pleinement OK."", '            ', '                        Cet avis vous a-t-il été utile ?                        Oui 1', 'Non 0', '                                  Client anonyme', '               ', '               publié le 02/11/2020', 'suite à une commande du 27/10/2020', ' ', ' ', '                  3/5', '               ', ""               je ne suis pas habitué, les skis sont pas mal rayés et détériorés sur le dessus et en très bon état dessous et c'est bien là l'essentiel"", '            ', '                        Cet avis vous a-t-il été utile ?                        Oui 2', 'Non 1', '×']"|3.0|2.0|0.0|0.0|2.0|0.0|0.0|https://freeglisse.com/35739-thickbox_default/ski-occasion-dynastar-cham-87-fixations.jpg
https://freeglisse.com/fr/ski-occasion-femme-loisir/14941-293331-ski-occasion-rossignol-temptation-75-s-fixations.html#/3-etat_du_materiel-qualite_a/910-taille_skis-168_cm|True|Ski occasion Rossignol Temptation 75 S + fixations|489.0|119.0|99.166667|['Ski occasion', 'Ski occasion femme', 'Occasion', 'Ski occasion femme loisir']|14941_l01|Blanc|Loisir|Piste|Femme|3.6|Ski occasion femme loisir|['Qualité A']|['168 cm']|Rossignol|6.0|kg|2025-01-31|False|"[""Le ski femme piste Rossignol TEMPTATION 75 S s'adresse aux skieuses débutantes à intermédiaires. La structure évoluée du ski et sa forme légèrement taille de guêpe permettent à ses utilisatrices d'entrer facilement en courbe et de rester maniable en toutes situations. "", 'Année : 2018', 'Prix neuf : 349 €', 'Lignes de côtes : 122 75 111', 'Rayon de 12 m pour un ski de 152 cm', 'Fiche technique', 'Type', 'Piste', 'Utilisateur', 'Femme', 'Niveau', 'Loisir', 'Coloris', 'Blanc', 'Economie de CO2 pour la planète (en kg)', '3.6', 'Type de produit', 'Ski occasion femme loisir', ""►\xa0État d'usure de nos skis et snowboards"", ""■ Qualité A : Matériel d'occasion en bon état"", ""Qualité A propose du matériel d'occasion ayant un bon état général, bien entretenu et pouvant être utilisé pendant de nombreuses saisons :"", 'Les qualités techniques et la durabilité du matériel sont excellentes', 'La sérigraphie peut également comporter quelques rayures et quelques accrocs', ""Fixations d'occasion en bon état (vérifiées par nos skimans) mais pouvant comporter cependant quelques rayures d'usage & quelque peu décolorées"", 'La semelle est parfaitement rebouchée, structurée et fartée. Les carres sont affûtées.', ""■ Qualité B : Matériel d'occasion en état correct"", ""La catégorie Qualité B possède du matériel d'occasion en état correct, mais présentant des marques d'usures plus prononcées (présence de rayures et d'accrocs) :"", 'La technicité et la durabilité du matériel restent bonnes malgré un esthétique plus ancien', ""Présence de rayures et d'accrocs plus prononcés sur plusieurs endroits de la sérigraphie, notamment au niveau de la spatule et du talon"", 'La fixation peut être rayée ou décolorée (toujours révisée par nos skimans)', 'La semelle est parfaitement rebouchée, structurée ainsi que fartée et les carres sont affûtées, comme pour le matériel de Qualité A', 'Prix attractif', '■ Qualité C : Matériel dont la sérigraphie est dégradée mais toujours performant', 'La catégorie Qualité C propose du matériel abîmé, dont la sérigraphie est dégradée mais qui reste skiable et performant :', ""Le matériel ayant déjà servi pendant plusieurs saisons, la sérigraphie est abimée et présente des traces plus importantes d'usures comme des rayures et des accrocs, mais qui n'a aucune influence sur la performance de celui-ci"", ""La fixation (toujours révisée par nos skimans) présente des traces d'usures plus importantes : décoloration, rayures, accrocs… Elle ne présente aucun danger pour l'utilisateur."", ""La semelle est parfaitement rebouchée, structurée et fartée. Les carres sont également affûtées, exactement comme les choix précédents. Attention : le matériel ayant déjà été bien utilisé, il ne reste plus beaucoup d'épaisseur de semelle ou de carre qui permettront de nouveaux entretiens."", 'Plus de détails sur la page\xa0état du matériel.', ""Voir l'attestation de confiance"", 'Avis soumis à un contrôle', ' ', ' ', "" Pour plus d'informations sur les caractéristiques du contrôle des avis et la possibilité de contacter l'auteur de l'avis, merci de consulter nos Charte de transparence."", "" Aucune contrepartie n'a été fournie en échange des avis"", ' Les avis sont publiés et conservés pendant une durée de cinq ans', "" Les avis ne sont pas modifiables : si un client souhaite modifier son avis, il doit contacter Avis Verifiés afin de supprimer l'avis existant, et en publier un nouveau"", ' Les motifs de suppression des avis sont disponibles ici.', '                  ', '               4 /5', ' ', ' ', '                Calculé à partir de   1  avis client(s)', '            ', '1', ' ', ' 0 ', '2', ' ', ' 0 ', '3', ' ', ' 0 ', '4', ' ', ' 1 ', '5', ' ', ' 0 ', ""Trier l'affichage des avis :"", '---', 'Les plus récents', 'Les plus anciens', 'Note la plus élevée', 'Note la plus faible', 'Les plus utiles ', '                                  Mickael L.', '               ', '               publié le 25/11/2023', 'suite à une commande du 12/11/2023', ' ', ' ', '                  4/5', '               ', ""               Pour une catégorie A , je pensais avoir moins d'usure visible ( esthétique) sinon ça va . La semelle semble propre donc satisfait quand même."", '            ', '                        Cet avis vous a-t-il été utile ?                        Oui 0', 'Non 0', '×']"|4.0|1.0|0.0|0.0|0.0|1.0|0.0|https://freeglisse.com/40825-thickbox_default/ski-occasion-rossignol-temptation-75-s-fixations.jpg
https://freeglisse.com/fr/ski-occasion-femme-loisir/14934-147618-ski-occasion-dynastar-exclusive-reveal-pro-fixations.html#/3-etat_du_materiel-qualite_a/905-taille_skis-163_cm|True|Ski occasion Dynastar Exclusive Reveal Pro + fixations|489.0|89.0|74.166667|['Ski occasion', 'Ski occasion femme', 'Occasion', 'Ski occasion femme loisir']|14934_k18|Blanc|Loisir sport|Piste|Femme|3.6|Ski occasion femme loisir|['Qualité A']|['163 cm']|Dynastar|6.0|kg|2025-01-31|False|"[""Ski avec une facilité de déclenchement et sécurité grâce à son rocker spatule et talon. Le contact ski/neige est doux du fait des lignes de cote modernes et progressives et du noyau bois. Ski doté d'un bon équilibre avant/arrière grâce à son Exclusive Balance System."", 'Ligne de cotes 124 73 100', 'Rayon de 12 m pour un ski de 153 cm', 'Prix du ski neuf: 299euros', 'Année: 2013', 'Fiche technique', 'Type', 'Piste', 'Utilisateur', 'Femme', 'Niveau', 'Loisir sport', 'Coloris', 'Blanc', 'Utilisateur - Configurateur', 'une femme', 'Economie de CO2 pour la planète (en kg)', '3.6', 'Type de produit', 'Ski occasion femme loisir', ""►\xa0État d'usure de nos skis et snowboards"", ""■ Qualité A : Matériel d'occasion en bon état"", ""Qualité A propose du matériel d'occasion ayant un bon état général, bien entretenu et pouvant être utilisé pendant de nombreuses saisons :"", 'Les qualités techniques et la durabilité du matériel sont excellentes', 'La sérigraphie peut également comporter quelques rayures et quelques accrocs', ""Fixations d'occasion en bon état (vérifiées par nos skimans) mais pouvant comporter cependant quelques rayures d'usage & quelque peu décolorées"", 'La semelle est parfaitement rebouchée, structurée et fartée. Les carres sont affûtées.', ""■ Qualité B : Matériel d'occasion en état correct"", ""La catégorie Qualité B possède du matériel d'occasion en état correct, mais présentant des marques d'usures plus prononcées (présence de rayures et d'accrocs) :"", 'La technicité et la durabilité du matériel restent bonnes malgré un esthétique plus ancien', ""Présence de rayures et d'accrocs plus prononcés sur plusieurs endroits de la sérigraphie, notamment au niveau de la spatule et du talon"", 'La fixation peut être rayée ou décolorée (toujours révisée par nos skimans)', 'La semelle est parfaitement rebouchée, structurée ainsi que fartée et les carres sont affûtées, comme pour le matériel de Qualité A', 'Prix attractif', '■ Qualité C : Matériel dont la sérigraphie est dégradée mais toujours performant', 'La catégorie Qualité C propose du matériel abîmé, dont la sérigraphie est dégradée mais qui reste skiable et performant :', ""Le matériel ayant déjà servi pendant plusieurs saisons, la sérigraphie est abimée et présente des traces plus importantes d'usures comme des rayures et des accrocs, mais qui n'a aucune influence sur la performance de celui-ci"", ""La fixation (toujours révisée par nos skimans) présente des traces d'usures plus importantes : décoloration, rayures, accrocs… Elle ne présente aucun danger pour l'utilisateur."", ""La semelle est parfaitement rebouchée, structurée et fartée. Les carres sont également affûtées, exactement comme les choix précédents. Attention : le matériel ayant déjà été bien utilisé, il ne reste plus beaucoup d'épaisseur de semelle ou de carre qui permettront de nouveaux entretiens."", 'Plus de détails sur la page\xa0état du matériel.', ""Voir l'attestation de confiance"", 'Avis soumis à un contrôle', ' ', ' ', "" Pour plus d'informations sur les caractéristiques du contrôle des avis et la possibilité de contacter l'auteur de l'avis, merci de consulter nos Charte de transparence."", "" Aucune contrepartie n'a été fournie en échange des avis"", ' Les avis sont publiés et conservés pendant une durée de cinq ans', "" Les avis ne sont pas modifiables : si un client souhaite modifier son avis, il doit contacter Avis Verifiés afin de supprimer l'avis existant, et en publier un nouveau"", ' Les motifs de suppression des avis sont disponibles ici.', '                  ', '               5 /5', ' ', ' ', '                Calculé à partir de   2  avis client(s)', '            ', '1', ' ', ' 0 ', '2', ' ', ' 0 ', '3', ' ', ' 0 ', '4', ' ', ' 0 ', '5', ' ', ' 2 ', ""Trier l'affichage des avis :"", '---', 'Les plus récents', 'Les plus anciens', 'Note la plus élevée', 'Note la plus faible', 'Les plus utiles ', '                                  Client anonyme', '               ', '               publié le 08/11/2022', 'suite à une commande du 28/10/2022', ' ', ' ', '                  5/5', '               ', '               conforme à mes attentes', '            ', '                        Cet avis vous a-t-il été utile ?                        Oui 0', 'Non 0', '                                  Client anonyme', '               ', '               publié le 18/01/2022', 'suite à une commande du 09/01/2022', ' ', ' ', '                  5/5', '               ', '               Suelas y cantos como nuevas. Perfecto.', '            ', '                        Cet avis vous a-t-il été utile ?                        Oui 0', 'Non 0', '×']"|5.0|2.0|0.0|0.0|0.0|0.0|2.0|https://freeglisse.com/39750-thickbox_default/ski-occasion-dynastar-exclusive-reveal-pro-fixations.jpg
