url|available|name|reg_price|current_price|pretax_price|cats|ref|color|level|type|user_type|co2_eco|product_type|quality|size|brand|weight|weight_type|price_valid_date|page_has_issues|desc|rating|nb_rating|rate_1|rate_2|rate_3|rate_4|rate_5|img
https://freeglisse.com/fr/mini-ski-occasion-adulte/18977-558720-mini-ski-occasion-snowblade-toutes-marques-tous-modeles-fixations.html#/9-etat_du_materiel-qualite_b/803-taille_skis-61_cm|True|Mini Ski occasion Snowblade Toutes Marques Tous Modèles + fixations|29.0|19.0|15.833334|['Ski occasion', 'Occasion', 'Ski occasion adulte', 'Mini-ski occasion adulte']|18977_a70|Noir|Loisir|All mountain|Mixte|3.6|Mini-ski occasion adulte|['Qualité B']|['61 cm', '90 cm', '93 cm', '98 cm', '99 cm', '100 cm']|Toutes marques|6.0|kg|2025-01-31|False|"['Un mini-ski facile à manier qui permet de progresser rapidement.', '100 % de plaisir garanti.', 'Vendus avec fixations plaques: pointure max 28MP', 'Fiche technique', 'Type', 'All mountain', 'Utilisateur', 'Mixte', 'Niveau', 'Loisir', 'Coloris', 'Noir', 'Economie de CO2 pour la planète (en kg)', '3.6', 'Type de produit', 'Mini-ski occasion adulte', ""►\xa0État d'usure de nos skis et snowboards"", ""■ Qualité A : Matériel d'occasion en bon état"", ""Qualité A propose du matériel d'occasion ayant un bon état général, bien entretenu et pouvant être utilisé pendant de nombreuses saisons :"", 'Les qualités techniques et la durabilité du matériel sont excellentes', 'La sérigraphie peut également comporter quelques rayures et quelques accrocs', ""Fixations d'occasion en bon état (vérifiées par nos skimans) mais pouvant comporter cependant quelques rayures d'usage & quelque peu décolorées"", 'La semelle est parfaitement rebouchée, structurée et fartée. Les carres sont affûtées.', ""■ Qualité B : Matériel d'occasion en état correct"", ""La catégorie Qualité B possède du matériel d'occasion en état correct, mais présentant des marques d'usures plus prononcées (présence de rayures et d'accrocs) :"", 'La technicité et la durabilité du matériel restent bonnes malgré un esthétique plus ancien', ""Présence de rayures et d'accrocs plus prononcés sur plusieurs endroits de la sérigraphie, notamment au niveau de la spatule et du talon"", 'La fixation peut être rayée ou décolorée (toujours révisée par nos skimans)', 'La semelle est parfaitement rebouchée, structurée ainsi que fartée et les carres sont affûtées, comme pour le matériel de Qualité A', 'Prix attractif', '■ Qualité C : Matériel dont la sérigraphie est dégradée mais toujours performant', 'La catégorie Qualité C propose du matériel abîmé, dont la sérigraphie est dégradée mais qui reste skiable et performant :', ""Le matériel ayant déjà servi pendant plusieurs saisons, la sérigraphie est abimée et présente des traces plus importantes d'usures comme des rayures et des accrocs, mais qui n'a aucune influence sur la performance de celui-ci"", ""La fixation (toujours révisée par nos skimans) présente des traces d'usures plus importantes : décoloration, rayures, accrocs… Elle ne présente aucun danger pour l'utilisateur."", ""La semelle est parfaitement rebouchée, structurée et fartée. Les carres sont également affûtées, exactement comme les choix précédents. Attention : le matériel ayant déjà été bien utilisé, il ne reste plus beaucoup d'épaisseur de semelle ou de carre qui permettront de nouveaux entretiens."", 'Plus de détails sur la page\xa0état du matériel.', ""Voir l'attestation de confiance"", 'Avis soumis à un contrôle', ' ', ' ', "" Pour plus d'informations sur les caractéristiques du contrôle des avis et la possibilité de contacter l'auteur de l'avis, merci de consulter nos Charte de transparence."", "" Aucune contrepartie n'a été fournie en échange des avis"", ' Les avis sont publiés et conservés pendant une durée de cinq ans', "" Les avis ne sont pas modifiables : si un client souhaite modifier son avis, il doit contacter Avis Verifiés afin de supprimer l'avis existant, et en publier un nouveau"", ' Les motifs de suppression des avis sont disponibles ici.', '                  ', '               5 /5', ' ', ' ', '                Calculé à partir de   2  avis client(s)', '            ', '1', ' ', ' 0 ', '2', ' ', ' 0 ', '3', ' ', ' 0 ', '4', ' ', ' 0 ', '5', ' ', ' 2 ', ""Trier l'affichage des avis :"", '---', 'Les plus récents', 'Les plus anciens', 'Note la plus élevée', 'Note la plus faible', 'Les plus utiles ', '                                  Daniel L.', '               ', '               publié le 29/12/2024', 'suite à une commande du 17/12/2024', ' ', ' ', '                  5/5', '               ', '               Bon état général', '            ', '                        Cet avis vous a-t-il été utile ?                        Oui 0', 'Non 0', '                                  Client anonyme', '               ', '               publié le 10/12/2024', 'suite à une commande du 24/11/2024', ' ', ' ', '                  5/5', '               ', ""               rapport qualité/prix c'est ok"", '            ', '                        Cet avis vous a-t-il été utile ?                        Oui 0', 'Non 0', '×']"|5.0|2.0|0.0|0.0|0.0|0.0|2.0|https://freeglisse.com/71641-thickbox_default/mini-ski-occasion-snowblade-toutes-marques-tous-modeles-fixations.jpg
https://freeglisse.com/fr/ski-occasion-adulte-freeride-et-freestyle/18916-431280-ski-occasion-rossignol-sender-104-ti-2024-fixations.html#/3-etat_du_materiel-qualite_a/906-taille_skis-164_cm|True|Ski occasion Rossignol Sender 104 Ti 2024  + Fixations|29.0|339.0|282.5|['Ski occasion', 'Occasion', 'Ski occasion adulte freeride et freestyle', 'Ski occasion freeride']|18916_m27|Gris|Performant|Freeride|Mixte|3.6|Ski occasion freeride|['Qualité A']|['164 cm', '172 cm', '178 cm']|Rossignol|6.0|kg|2025-01-31|False|"['De la poudreuse à la neige tassée, le nouveau Sender 104 Ti est l’arme absolue pour dompter toute la montagne. Sa facilité et sa réactivité permettent d’aller sur n’importe quel terrain, sur piste ou hors piste, grâce à double technologie LCT et Air Tip. Notre technologie d’amortissement des vibrations s’associe à un noyau léger en bois de paulownia pour offrir la polyvalence nécessaire pour la glisse décontractée ou l’attaque à outrance. Franchissez les limites et lancez-vous sans hésitation sur tous les terrains.', 'Lignes de cotes : 138 104 128', 'Rayon de 18m pour un ski de 178cm', ""Ski de l'année 2024 sorti une saison en location "", 'Valeur du ski neuf avec fixation : 869 €', 'Fiche technique', 'Type', 'Freeride', 'Utilisateur', 'Mixte', 'Niveau', 'Performant', 'Coloris', 'Gris', 'Utilisateur - Configurateur', 'Freerideur adulte', 'Economie de CO2 pour la planète (en kg)', '3.6', 'Type de produit', 'Ski occasion freeride', ""►\xa0État d'usure de nos skis et snowboards"", ""■ Qualité A : Matériel d'occasion en bon état"", ""Qualité A propose du matériel d'occasion ayant un bon état général, bien entretenu et pouvant être utilisé pendant de nombreuses saisons :"", 'Les qualités techniques et la durabilité du matériel sont excellentes', 'La sérigraphie peut également comporter quelques rayures et quelques accrocs', ""Fixations d'occasion en bon état (vérifiées par nos skimans) mais pouvant comporter cependant quelques rayures d'usage & quelque peu décolorées"", 'La semelle est parfaitement rebouchée, structurée et fartée. Les carres sont affûtées.', ""■ Qualité B : Matériel d'occasion en état correct"", ""La catégorie Qualité B possède du matériel d'occasion en état correct, mais présentant des marques d'usures plus prononcées (présence de rayures et d'accrocs) :"", 'La technicité et la durabilité du matériel restent bonnes malgré un esthétique plus ancien', ""Présence de rayures et d'accrocs plus prononcés sur plusieurs endroits de la sérigraphie, notamment au niveau de la spatule et du talon"", 'La fixation peut être rayée ou décolorée (toujours révisée par nos skimans)', 'La semelle est parfaitement rebouchée, structurée ainsi que fartée et les carres sont affûtées, comme pour le matériel de Qualité A', 'Prix attractif', '■ Qualité C : Matériel dont la sérigraphie est dégradée mais toujours performant', 'La catégorie Qualité C propose du matériel abîmé, dont la sérigraphie est dégradée mais qui reste skiable et performant :', ""Le matériel ayant déjà servi pendant plusieurs saisons, la sérigraphie est abimée et présente des traces plus importantes d'usures comme des rayures et des accrocs, mais qui n'a aucune influence sur la performance de celui-ci"", ""La fixation (toujours révisée par nos skimans) présente des traces d'usures plus importantes : décoloration, rayures, accrocs… Elle ne présente aucun danger pour l'utilisateur."", ""La semelle est parfaitement rebouchée, structurée et fartée. Les carres sont également affûtées, exactement comme les choix précédents. Attention : le matériel ayant déjà été bien utilisé, il ne reste plus beaucoup d'épaisseur de semelle ou de carre qui permettront de nouveaux entretiens."", 'Plus de détails sur la page\xa0état du matériel.', ""Voir l'attestation de confiance"", 'Avis soumis à un contrôle', ' ', ' ', "" Pour plus d'informations sur les caractéristiques du contrôle des avis et la possibilité de contacter l'auteur de l'avis, merci de consulter nos Charte de transparence."", "" Aucune contrepartie n'a été fournie en échange des avis"", ' Les avis sont publiés et conservés pendant une durée de cinq ans', "" Les avis ne sont pas modifiables : si un client souhaite modifier son avis, il doit contacter Avis Verifiés afin de supprimer l'avis existant, et en publier un nouveau"", ' Les motifs de suppression des avis sont disponibles ici.', '                  ', '               4.3 /5', ' ', ' ', '                Calculé à partir de   3  avis client(s)', '            ', '1', ' ', ' 0 ', '2', ' ', ' 0 ', '3', ' ', ' 1 ', '4', ' ', ' 0 ', '5', ' ', ' 2 ', ""Trier l'affichage des avis :"", '---', 'Les plus récents', 'Les plus anciens', 'Note la plus élevée', 'Note la plus faible', 'Les plus utiles ', '                                  Stéphane C.', '               ', '               publié le 09/12/2024', 'suite à une commande du 26/11/2024', ' ', ' ', '                  5/5', '               ', ""               Skis en très bon état, plus que je ne l'espérais même si la qualité était notée en A."", '            ', '                        Cet avis vous a-t-il été utile ?                        Oui 0', 'Non 0', '                                  Sébastien J.', '               ', '               publié le 16/10/2024', 'suite à une commande du 03/10/2024', ' ', ' ', '                  3/5', '               ', ""               Bonjour je suis dessus de l'état des skis qui était noté pourtant avec un A.\r"", ""Ils sont bien abîmés ainsi que les fixations j'ai pensé les renvoyer ?\r"", ""Après je suis sur que c'est un très bon site mais peut être arrêt t'il du mettre une note B."", '            ', '                        Cet avis vous a-t-il été utile ?                        Oui 0', 'Non 0', '                                  FERNAND L.', '               ', '               publié le 17/04/2024', 'suite à une commande du 09/04/2024', ' ', ' ', '                  5/5', '               ', ""               Hormis le problème de fixations après avoir pris le soins de les lustré préparé les cares et fartage la notation qualité A n'ai pas mis en  défaut."", '            ', '                        Cet avis vous a-t-il été utile ?                        Oui 0', 'Non 0', '×']"|4.3|3.0|0.0|0.0|1.0|0.0|2.0|https://freeglisse.com/70892-thickbox_default/ski-occasion-rossignol-sender-104-ti-2024-fixations.jpg
https://freeglisse.com/fr/ski-occasion-freeride/18915-431270-ski-occasion-rossignol-sender-94-ti-fixations.html#/3-etat_du_materiel-qualite_a/898-taille_skis-156_cm|True|Ski occasion Rossignol Sender 94 Ti + fixations|418.0|319.0|265.833331|['Ski occasion', 'Occasion', 'Ski occasion adulte freeride et freestyle', 'Ski occasion freeride']|18915_i26|Noir|Performant|Freeride|Mixte|3.6|Ski occasion freeride|['Qualité A']|['156 cm', '164 cm', '172 cm', '178 cm']|Rossignol|6.0|kg|2025-01-31|False|"['Le véritable ski de freeride All-Mountain. Lorsque la neige fraîche vous appelle, le Sender 94 Ti offre l’association idéale d’agilité, de légèreté et de performances en descente pour vous permettre d’explorer le domaine et d’en franchir les limites. La faible inertie de rotation procurée par notre technologie Air Tip emblématique préserve son comportement ludique, tandis que le noyau léger en bois de paulownia facilite les ascensions à peaux de phoque et le portage sur le dos.', 'Lignes de cotes : 128 94 108', 'Rayon de 19m pour un ski de 178cm', 'Année : 2023', 'Prix neuf : 710€', 'Fiche technique', 'Type', 'Freeride', 'Utilisateur', 'Mixte', 'Niveau', 'Performant', 'Coloris', 'Noir', 'Utilisateur - Configurateur', 'Freerideur adulte', 'Economie de CO2 pour la planète (en kg)', '3.6', 'Type de produit', 'Ski occasion freeride', ""►\xa0État d'usure de nos skis et snowboards"", ""■ Qualité A : Matériel d'occasion en bon état"", ""Qualité A propose du matériel d'occasion ayant un bon état général, bien entretenu et pouvant être utilisé pendant de nombreuses saisons :"", 'Les qualités techniques et la durabilité du matériel sont excellentes', 'La sérigraphie peut également comporter quelques rayures et quelques accrocs', ""Fixations d'occasion en bon état (vérifiées par nos skimans) mais pouvant comporter cependant quelques rayures d'usage & quelque peu décolorées"", 'La semelle est parfaitement rebouchée, structurée et fartée. Les carres sont affûtées.', ""■ Qualité B : Matériel d'occasion en état correct"", ""La catégorie Qualité B possède du matériel d'occasion en état correct, mais présentant des marques d'usures plus prononcées (présence de rayures et d'accrocs) :"", 'La technicité et la durabilité du matériel restent bonnes malgré un esthétique plus ancien', ""Présence de rayures et d'accrocs plus prononcés sur plusieurs endroits de la sérigraphie, notamment au niveau de la spatule et du talon"", 'La fixation peut être rayée ou décolorée (toujours révisée par nos skimans)', 'La semelle est parfaitement rebouchée, structurée ainsi que fartée et les carres sont affûtées, comme pour le matériel de Qualité A', 'Prix attractif', '■ Qualité C : Matériel dont la sérigraphie est dégradée mais toujours performant', 'La catégorie Qualité C propose du matériel abîmé, dont la sérigraphie est dégradée mais qui reste skiable et performant :', ""Le matériel ayant déjà servi pendant plusieurs saisons, la sérigraphie est abimée et présente des traces plus importantes d'usures comme des rayures et des accrocs, mais qui n'a aucune influence sur la performance de celui-ci"", ""La fixation (toujours révisée par nos skimans) présente des traces d'usures plus importantes : décoloration, rayures, accrocs… Elle ne présente aucun danger pour l'utilisateur."", ""La semelle est parfaitement rebouchée, structurée et fartée. Les carres sont également affûtées, exactement comme les choix précédents. Attention : le matériel ayant déjà été bien utilisé, il ne reste plus beaucoup d'épaisseur de semelle ou de carre qui permettront de nouveaux entretiens."", 'Plus de détails sur la page\xa0état du matériel.', ""Voir l'attestation de confiance"", 'Avis soumis à un contrôle', ' ', ' ', "" Pour plus d'informations sur les caractéristiques du contrôle des avis et la possibilité de contacter l'auteur de l'avis, merci de consulter nos Charte de transparence."", "" Aucune contrepartie n'a été fournie en échange des avis"", ' Les avis sont publiés et conservés pendant une durée de cinq ans', "" Les avis ne sont pas modifiables : si un client souhaite modifier son avis, il doit contacter Avis Verifiés afin de supprimer l'avis existant, et en publier un nouveau"", ' Les motifs de suppression des avis sont disponibles ici.', '                  ', '               4.7 /5', ' ', ' ', '                Calculé à partir de   3  avis client(s)', '            ', '1', ' ', ' 0 ', '2', ' ', ' 0 ', '3', ' ', ' 0 ', '4', ' ', ' 1 ', '5', ' ', ' 2 ', ""Trier l'affichage des avis :"", '---', 'Les plus récents', 'Les plus anciens', 'Note la plus élevée', 'Note la plus faible', 'Les plus utiles ', '                                  Sabri G.', '               ', '               publié le 22/12/2024', 'suite à une commande du 08/12/2024', ' ', ' ', '                  5/5', '               ', '               De très bonne qualité', '            ', '                        Cet avis vous a-t-il été utile ?                        Oui 0', 'Non 0', '                                  Jeremy B.', '               ', '               publié le 10/10/2024', 'suite à une commande du 23/09/2024', ' ', ' ', '                  5/5', '               ', ""               Instruction d'envoi respecté. \r"", 'Qualité du produit tel quel que les photos envoyées.', '            ', '                        Cet avis vous a-t-il été utile ?                        Oui 0', 'Non 0', '                                  Peio A.', '               ', '               publié le 11/11/2023', 'suite à une commande du 01/11/2023', ' ', ' ', '                  4/5', '               ', '               good cuality', '            ', '                        Cet avis vous a-t-il été utile ?                        Oui 0', 'Non 0', '×']"|4.7|3.0|0.0|0.0|0.0|1.0|2.0|https://freeglisse.com/70897-thickbox_default/ski-occasion-rossignol-sender-94-ti-fixations.jpg
https://freeglisse.com/fr/ski-occasion-junior-loisir/20072-551972-ski-occasion-junior-rossignol-hero-jr-2022-fixations.html#/3-etat_du_materiel-qualite_a/842-taille_skis-100_cm|True|Ski occasion junior Rossignol Hero Jr 2022 + fixations|122.0|69.0|57.5|['Ski occasion', 'Ski occasion junior', 'Occasion', 'Ski occasion junior loisir']|20072_a01|Rouge|Loisir sport|Piste|Junior|3.6|Ski occasion junior loisir|['Qualité A']|['100 cm', '110 cm', '120 cm', '130 cm']|Rossignol|6.0|kg|2025-01-31|False|"[""Conçu pour aider les jeunes skieurs à acquérir des bases solides, le ski Hero Junior de Rossignol est un ski de piste léger, idéal pour les niveaux débutant et intermédiaire. Il facilite le déclenchement des virages et le contrôle des carres, accélérant ainsi la courbe d'apprentissage. Grâce à sa flexibilité adaptée à la taille des jeunes skieurs, ce modèle offre un confort immédiat et une utilisation intuitive, permettant aux enfants d'améliorer leurs compétences en toute simplicité."", ""Confort instantané et facilité d'utilisation :"", 'La construction en cap allège le ski et améliore le confort lors de la pratique.', 'Carving performant :', ""La ligne de cotes surdimensionnée permet d'exécuter des virages parfaits."", 'Performances fluides et énergiques :', 'Le noyau HD Core assure un bon compromis entre glisse et amorti, offrant une glisse énergique sur les neiges et terrains mixtes.', 'Ligne de cote : 108 97 104\xa0', 'Rayon de 10m pour un ski de 130cm', 'Année : 2022', 'Fiche technique', 'Type', 'Piste', 'Utilisateur', 'Junior', 'Niveau', 'Loisir sport', 'Coloris', 'Rouge', 'Utilisateur - Configurateur', 'un junior', 'Economie de CO2 pour la planète (en kg)', '3.6', 'Type de produit', 'Ski occasion junior loisir', ""►\xa0État d'usure de nos skis et snowboards"", ""■ Qualité A : Matériel d'occasion en bon état"", ""Qualité A propose du matériel d'occasion ayant un bon état général, bien entretenu et pouvant être utilisé pendant de nombreuses saisons :"", 'Les qualités techniques et la durabilité du matériel sont excellentes', 'La sérigraphie peut également comporter quelques rayures et quelques accrocs', ""Fixations d'occasion en bon état (vérifiées par nos skimans) mais pouvant comporter cependant quelques rayures d'usage & quelque peu décolorées"", 'La semelle est parfaitement rebouchée, structurée et fartée. Les carres sont affûtées.', ""■ Qualité B : Matériel d'occasion en état correct"", ""La catégorie Qualité B possède du matériel d'occasion en état correct, mais présentant des marques d'usures plus prononcées (présence de rayures et d'accrocs) :"", 'La technicité et la durabilité du matériel restent bonnes malgré un esthétique plus ancien', ""Présence de rayures et d'accrocs plus prononcés sur plusieurs endroits de la sérigraphie, notamment au niveau de la spatule et du talon"", 'La fixation peut être rayée ou décolorée (toujours révisée par nos skimans)', 'La semelle est parfaitement rebouchée, structurée ainsi que fartée et les carres sont affûtées, comme pour le matériel de Qualité A', 'Prix attractif', '■ Qualité C : Matériel dont la sérigraphie est dégradée mais toujours performant', 'La catégorie Qualité C propose du matériel abîmé, dont la sérigraphie est dégradée mais qui reste skiable et performant :', ""Le matériel ayant déjà servi pendant plusieurs saisons, la sérigraphie est abimée et présente des traces plus importantes d'usures comme des rayures et des accrocs, mais qui n'a aucune influence sur la performance de celui-ci"", ""La fixation (toujours révisée par nos skimans) présente des traces d'usures plus importantes : décoloration, rayures, accrocs… Elle ne présente aucun danger pour l'utilisateur."", ""La semelle est parfaitement rebouchée, structurée et fartée. Les carres sont également affûtées, exactement comme les choix précédents. Attention : le matériel ayant déjà été bien utilisé, il ne reste plus beaucoup d'épaisseur de semelle ou de carre qui permettront de nouveaux entretiens."", 'Plus de détails sur la page\xa0état du matériel.', ""Voir l'attestation de confiance"", 'Avis soumis à un contrôle', ' ', ' ', "" Pour plus d'informations sur les caractéristiques du contrôle des avis et la possibilité de contacter l'auteur de l'avis, merci de consulter nos Charte de transparence."", "" Aucune contrepartie n'a été fournie en échange des avis"", ' Les avis sont publiés et conservés pendant une durée de cinq ans', "" Les avis ne sont pas modifiables : si un client souhaite modifier son avis, il doit contacter Avis Verifiés afin de supprimer l'avis existant, et en publier un nouveau"", ' Les motifs de suppression des avis sont disponibles ici.', '                  ', '               4.3 /5', ' ', ' ', '                Calculé à partir de   4  avis client(s)', '            ', '1', ' ', ' 0 ', '2', ' ', ' 1 ', '3', ' ', ' 0 ', '4', ' ', ' 0 ', '5', ' ', ' 3 ', ""Trier l'affichage des avis :"", '---', 'Les plus récents', 'Les plus anciens', 'Note la plus élevée', 'Note la plus faible', 'Les plus utiles ', '                                  Alexandre M.', '               ', '               publié le 23/12/2024', 'suite à une commande du 10/12/2024', ' ', ' ', '                  5/5', '               ', '               Très bien', '            ', '                        Cet avis vous a-t-il été utile ?                        Oui 0', 'Non 0', '                                  Client anonyme', '               ', '               publié le 17/12/2024', 'suite à une commande du 01/12/2024', ' ', ' ', '                  2/5', '               ', '               Convenable', '            ', '                        Cet avis vous a-t-il été utile ?                        Oui 0', 'Non 0', '                                  Anthony Z.', '               ', '               publié le 10/12/2024', 'suite à une commande du 23/11/2024', ' ', ' ', '                  5/5', '               ', '               Nickel', '            ', '                        Cet avis vous a-t-il été utile ?                        Oui 0', 'Non 0', '                                  Julien D.', '               ', '               publié le 20/10/2024', 'suite à une commande du 07/10/2024', ' ', ' ', '                  5/5', '               ', '               Très bon état général avec les fixations déjà réglées suivant les chaussures achetées en même temps. Parfait', '            ', '                        Cet avis vous a-t-il été utile ?                        Oui 0', 'Non 0', '×']"|4.3|4.0|0.0|1.0|0.0|0.0|3.0|https://freeglisse.com/80564-thickbox_default/ski-occasion-junior-rossignol-hero-jr-2022-fixations.jpg
